genre,title,poster_link,description,labels
action,Titans,"https://m.media-amazon.com/images/M/MV5BMjA2ZTIxYjktMWUwMi00MDU5LTlmMDYtMTI4ODc1MDY4YzNjXkEyXkFqcGdeQXVyMTkxNjUyNQ@@._V1_QL75_UX190_CR0,0,190,281_.jpg",A team of young superheroes combat evil and other perils.,Action Adventure Crime
action,The Flash,"https://m.media-amazon.com/images/M/MV5BMDIzNzYwNTctZWY4Mi00YjQ2LWI5YWYtMzdmNDgwMGI4Yzk1XkEyXkFqcGdeQXVyMTkxNjUyNQ@@._V1_QL75_UY281_CR18,0,190,281_.jpg","After being struck by lightning, Barry Allen wakes up from his coma to discover he's been given the power of super speed, becoming the Flash, and fighting crime in Central City.",Action Adventure Drama
action,Memory,"https://m.media-amazon.com/images/M/MV5BOGI5N2FhNzktZjZlNi00MmRjLWE1MmUtNjRlNzQyOGMzYjNhXkEyXkFqcGdeQXVyMDA4NzMyOA@@._V1_QL75_UX190_CR0,0,190,281_.jpg",An assassin-for-hire finds that he's become a target after he refuses to complete a job for a dangerous criminal organization.,Action Crime Thriller
action,The Umbrella Academy,"https://m.media-amazon.com/images/M/MV5BOTdlODM0MTAtMzRiZi00MTQxLWE0MGUtNTNjOGZjNjAzN2E0XkEyXkFqcGdeQXVyMTkxNjUyNQ@@._V1_QL75_UY281_CR18,0,190,281_.jpg","A family of former child heroes, now grown apart, must reunite to continue to protect the world.",Action Adventure Comedy
action,The Dark Knight,"https://m.media-amazon.com/images/M/MV5BMTMxNTMwODM0NF5BMl5BanBnXkFtZTcwODAyMTk2Mw@@._V1_QL75_UX190_CR0,0,190,281_.jpg","When the menace known as the Joker wreaks havoc and chaos on the people of Gotham, Batman must accept one of the greatest psychological and physical tests of his ability to fight injustice.",Action Crime Drama
action,Rogue One: A Star Wars Story,"https://m.media-amazon.com/images/M/MV5BMjEwMzMxODIzOV5BMl5BanBnXkFtZTgwNzg3OTAzMDI@._V1_QL75_UX190_CR0,0,190,281_.jpg","In a time of conflict, a group of unlikely heroes band together on a mission to steal the plans to the Death Star, the Empire's ultimate weapon of destruction.",Action Adventure Sci-Fi
action,The Wheel of Time,"https://m.media-amazon.com/images/M/MV5BYzA2Nzk5M2EtNWY4Yi00ZDY4LThkZTgtYjhhNWEyMGY0MjFjXkEyXkFqcGdeQXVyMTkxNjUyNQ@@._V1_QL75_UX190_CR0,0,190,281_.jpg","Set in a high fantasy world where magic exists, but only some can access it, a woman named Moiraine crosses paths with five young men and women. This sparks a dangerous, world-spanning journey. Based on the book series by Robert Jordan.",Action Adventure Drama
action,The Expendables 4,"https://m.media-amazon.com/images/M/MV5BNGIzNjU5YTctMDllZi00MGU2LWI5MTYtYzc4ZGFjNzY5ZjYyXkEyXkFqcGdeQXVyODY5NzkyMjA@._V1_QL75_UY281_CR258,0,190,281_.jpg",The Expendables will square up against: an arms dealer who commands the might of a massive private army.,Action Adventure Thriller
action,The Lost City,"https://m.media-amazon.com/images/M/MV5BMmIwYzFhODAtY2I1YS00ZDdmLTkyYWQtZjI5NDIwMDc2MjEyXkEyXkFqcGdeQXVyODk4OTc3MTY@._V1_QL75_UX190_CR0,0,190,281_.jpg",A reclusive romance novelist on a book tour with her cover model gets swept up in a kidnapping attempt that lands them both in a cutthroat jungle adventure.,Action Adventure Comedy
action,No Time to Die,"https://m.media-amazon.com/images/M/MV5BYWQ2NzQ1NjktMzNkNS00MGY1LTgwMmMtYTllYTI5YzNmMmE0XkEyXkFqcGdeQXVyMjM4NTM5NDY@._V1_QL75_UX190_CR0,0,190,281_.jpg","James Bond has left active service. His peace is short-lived when Felix Leiter, an old friend from the CIA, turns up asking for help, leading Bond onto the trail of a mysterious villain armed with dangerous new technology.",Action Adventure Thriller
action,Doctor Strange in the Multiverse of Madness,"https://m.media-amazon.com/images/M/MV5BNWM0ZGJlMzMtZmYwMi00NzI3LTgzMzMtNjMzNjliNDRmZmFlXkEyXkFqcGdeQXVyMTM1MTE1NDMx._V1_QL75_UX190_CR0,0,190,281_.jpg","Doctor Strange teams up with a mysterious teenage girl from his dreams who can travel across multiverses, to battle multiple threats, including other-universe versions of himself, which threaten to wipe out millions across the multiverse. They seek help from Wanda the Scarlet Witch, Wong and others.",Action Adventure Fantasy
action,Ghostbusters,"https://m.media-amazon.com/images/M/MV5BMTkxMjYyNzgwMl5BMl5BanBnXkFtZTgwMTE3MjYyMTE@._V1_QL75_UX190_CR0,5,190,281_.jpg","Three parapsychologists forced out of their university funding set up shop as a unique ghost removal service in New York City, attracting frightened yet skeptical customers.",Action Comedy Fantasy
action,The Lord of the Rings: The Two Towers,"https://m.media-amazon.com/images/M/MV5BZGMxZTdjZmYtMmE2Ni00ZTdkLWI5NTgtNjlmMjBiNzU2MmI5XkEyXkFqcGdeQXVyNjU0OTQ0OTY@._V1_QL75_UX190_CR0,7,190,281_.jpg","While Frodo and Sam edge closer to Mordor with the help of the shifty Gollum, the divided fellowship makes a stand against Sauron's new ally, Saruman, and his hordes of Isengard.",Action Adventure Drama
action,Quantum Leap,"https://m.media-amazon.com/images/M/MV5BMDg1MWQzYmYtYTljMy00NDU3LWE1ZWItNWMzN2NlOTRkZjdmL2ltYWdlL2ltYWdlXkEyXkFqcGdeQXVyMTEwMTkwOTI@._V1_QL75_UY281_CR2,0,190,281_.jpg","During a government experiment into time travel, a scientist finds himself trapped in the past, ""leaping"" into the bodies of different people on a regular basis and sorting out their problems whilst trying to get back home to his own time.",Action Adventure Drama
action,Smallville,"https://m.media-amazon.com/images/M/MV5BYmNiNzlhOWItMDM5Mi00MGYzLWI1ZDYtNmI5NzI0MWFkMTIwXkEyXkFqcGdeQXVyNjU2NjA5NjM@._V1_QL75_UY281_CR7,0,190,281_.jpg","A young Clark Kent struggles to find his place in the world as he learns to harness his alien powers for good and deals with the typical troubles of teenage life in Smallville, Kansas.",Action Adventure Drama
action,Star Trek: The Next Generation,"https://m.media-amazon.com/images/M/MV5BOWFhYjE4NzMtOWJmZi00NzEyLTg5NTctYmIxMTU1ZDIxMDAyXkEyXkFqcGdeQXVyNTE1NjY5Mg@@._V1_QL75_UY281_CR4,0,190,281_.jpg","Set almost 100 years after Captain Kirk's 5-year mission, a new generation of Starfleet officers set off in the U.S.S. Enterprise-D on its own mission to go where no one has gone before.",Action Adventure Sci-Fi
action,Star Trek: Lower Decks,"https://m.media-amazon.com/images/M/MV5BYzE3NTNkZDUtMWQwYy00NDIxLTgzZGYtZTMxNmYyMTcyYzA1XkEyXkFqcGdeQXVyMTM1MTE1NDMx._V1_QL75_UX190_CR0,0,190,281_.jpg","The support crew serving on one of Starfleet's least important ships, the U.S.S. Cerritos, have to keep up with their duties, often while the ship is being rocked by a multitude of sci-fi anomalies.",Animation Action Adventure
action,Obi-Wan Kenobi,"https://m.media-amazon.com/images/M/MV5BOTAxOTlmOTAtMjA0Yy00YjVjLWE3OTQtYjAzMWMxOTAwZTY1XkEyXkFqcGdeQXVyMTM1MTE1NDMx._V1_QL75_UX190_CR0,0,190,281_.jpg","Jedi Master Obi-Wan Kenobi has to save young Leia after she is kidnapped, all the while being pursued by Imperial Inquisitors and his former Padawan, now known as Darth Vader.",Action Adventure Sci-Fi
action,FBI: Most Wanted,"https://m.media-amazon.com/images/M/MV5BZWE5ZmZmOTgtYzI0YS00ZDY4LWFiZmItMGVmYWZjMjlkMTYwXkEyXkFqcGdeQXVyNjc1NjcwNTg@._V1_QL75_UY281_CR10,0,190,281_.jpg",It follows the division of the FBI tasked with tracking and capturing the notorious criminals on the FBI's Most Wanted list.,Action Crime Drama
action,Accident Man: Hitman's Holiday,"https://m.media-amazon.com/images/M/MV5BMTU5MWY3YTEtYmYwNC00MGU1LTk2YWMtOTk0YjgxNDM3NjdjXkEyXkFqcGdeQXVyMjE4NzUxNDA@._V1_QL75_UX190_CR0,0,190,281_.jpg","The Accident Man, is back and this time he must beat the top assassins in the world, to protect the ungrateful son of a mafia boss, save the life of his only friend and rekindle his relationship with his maniacal father figure.",Action Comedy Crime
action,Dracula Untold,"https://m.media-amazon.com/images/M/MV5BMTkzNzI1OTI4N15BMl5BanBnXkFtZTgwNTQ2NzEwMjE@._V1_QL75_UX190_CR0,10,190,281_.jpg","As his kingdom is being threatened by the Turks, young prince Vlad Tepes must become a monster feared by his own people in order to obtain the power needed to protect his own family, and the families of his kingdom.",Action Drama Fantasy
action,Athena,"https://m.media-amazon.com/images/M/MV5BNGY2OTg3ZjAtNTYyMC00MzAwLTg5NzEtZTdkNmFlMzA2ZGY5XkEyXkFqcGdeQXVyODA0MjgyNzM@._V1_QL75_UY281_CR2,0,190,281_.jpg","Hours after the tragic death of their youngest brother in unexplained circumstances, three siblings have their lives thrown into chaos.",Action Drama Thriller
action,Tenet,"https://m.media-amazon.com/images/M/MV5BYzg0NGM2NjAtNmIxOC00MDJmLTg5ZmYtYzM0MTE4NWE2NzlhXkEyXkFqcGdeQXVyMTA4NjE0NjEy._V1_QL75_UX190_CR0,2,190,281_.jpg","Armed with only one word, Tenet, and fighting for the survival of the entire world, a Protagonist journeys through a twilight world of international espionage on a mission that will unfold in something beyond real time.",Action Sci-Fi Thriller
action,The Gentlemen,"https://m.media-amazon.com/images/M/MV5BMTlkMmVmYjktYTc2NC00ZGZjLWEyOWUtMjc2MDMwMjQwOTA5XkEyXkFqcGdeQXVyNTI4MzE4MDU@._V1_QL75_UX190_CR0,0,190,281_.jpg","An American expat tries to sell off his highly profitable marijuana empire in London, triggering plots, schemes, bribery and blackmail in an attempt to steal his domain out from under him.",Action Comedy Crime
action,Arcane,"https://m.media-amazon.com/images/M/MV5BYmU5OWM5ZTAtNjUzOC00NmUyLTgyOWMtMjlkNjdlMDAzMzU1XkEyXkFqcGdeQXVyMDM2NDM2MQ@@._V1_QL75_UX190_CR0,0,190,281_.jpg","Set in utopian Piltover and the oppressed underground of Zaun, the story follows the origins of two iconic League champions-and the power that will tear them apart.",Animation Action Adventure
action,Archer,"https://m.media-amazon.com/images/M/MV5BMTg3NTMwMzY2OF5BMl5BanBnXkFtZTgwMDcxMjQ0NDE@._V1_QL75_UX190_CR0,2,190,281_.jpg",Covert black ops and espionage take a back seat to zany personalities and relationships between secret agents and drones.,Animation Action Comedy
action,The Equalizer,"https://m.media-amazon.com/images/M/MV5BYmY3MTgwYWUtMTc2NC00ZDdmLWIyNDAtOGJkNTQyZjM0NDA5XkEyXkFqcGdeQXVyMTEyMjM2NDc2._V1_QL75_UY281_CR0,0,190,281_.jpg",An enigmatic figure who uses her extensive skills to help those with nowhere else to turn.,Action Crime Drama
action,RRR,"https://m.media-amazon.com/images/M/MV5BODUwNDNjYzctODUxNy00ZTA2LWIyYTEtMDc5Y2E5ZjBmNTMzXkEyXkFqcGdeQXVyODE5NzE3OTE@._V1_QL75_UY281_CR11,0,190,281_.jpg",A fictitious story about two legendary revolutionaries and their journey away from home before they started fighting for their country in the 1920s.,Action Drama
action,Inception,"https://m.media-amazon.com/images/M/MV5BMjAxMzY3NjcxNF5BMl5BanBnXkFtZTcwNTI5OTM0Mw@@._V1_QL75_UX190_CR0,0,190,281_.jpg","A thief who steals corporate secrets through the use of dream-sharing technology is given the inverse task of planting an idea into the mind of a C.E.O., but his tragic past may doom the project and his team to disaster.",Action Adventure Sci-Fi
action,Avengers: Endgame,"https://m.media-amazon.com/images/M/MV5BMTc5MDE2ODcwNV5BMl5BanBnXkFtZTgwMzI2NzQ2NzM@._V1_QL75_UX190_CR0,0,190,281_.jpg","After the devastating events of Avengers: Infinity War (2018), the universe is in ruins. With the help of remaining allies, the Avengers assemble once more in order to reverse Thanos' actions and restore balance to the universe.",Action Adventure Drama
action,My Hero Academia,"https://m.media-amazon.com/images/M/MV5BNzBlMDU5NzgtYTBiMC00ODYwLTg2YzItNTczYjY1OTRmNGFhXkEyXkFqcGdeQXVyMzgxODM4NjM@._V1_QL75_UX190_CR0,2,190,281_.jpg",A superhero-loving boy without any powers is determined to enroll in a prestigious hero academy and learn what it really means to be a hero.,Animation Action Adventure
action,Willow,"https://m.media-amazon.com/images/M/MV5BOTJkZmMwYWYtMzAxZi00Mzk1LWE2ZDctMDBkMzRhNGVmNjBjXkEyXkFqcGdeQXVyMTUzMTg2ODkz._V1_QL75_UX190_CR0,0,190,281_.jpg","An unlikely group of heroes sets off on a dangerous quest to places far beyond their home, where they must face their inner demons and come together to save their world.",Action Adventure Drama
action,NCIS: Hawai'i,"https://m.media-amazon.com/images/M/MV5BOTBmMTI2NWEtNWEzNi00MzU3LTk1ZTgtMzA1MTczNDIyYjI0XkEyXkFqcGdeQXVyMTkxNjUyNQ@@._V1_QL75_UX190_CR0,0,190,281_.jpg",Follow a team of Naval criminal investigators who operate on the Hawaiian islands.,Action Crime Mystery
action,Money Heist,"https://m.media-amazon.com/images/M/MV5BODI0ZTljYTMtODQ1NC00NmI0LTk1YWUtN2FlNDM1MDExMDlhXkEyXkFqcGdeQXVyMTM0NTUzNDIy._V1_QL75_UX190_CR0,2,190,281_.jpg",An unusual group of robbers attempt to carry out the most perfect robbery in Spanish history - stealing 2.4 billion euros from the Royal Mint of Spain.,Action Crime Drama
action,Creed,"https://m.media-amazon.com/images/M/MV5BNmZkYjQzY2QtNjdkNC00YjkzLTk5NjUtY2MyNDNiYTBhN2M2XkEyXkFqcGdeQXVyMjMwNDgzNjc@._V1_QL75_UX190_CR0,0,190,281_.jpg","The former World Heavyweight Champion Rocky Balboa serves as a trainer and mentor to Adonis Johnson, the son of his late friend and former rival Apollo Creed.",Action Drama Sport
action,The Unbearable Weight of Massive Talent,"https://m.media-amazon.com/images/M/MV5BNDM2ODNiMWItOWRkNS00ODE3LWE2OGYtNTZkMDJkOWI1ODMxXkEyXkFqcGdeQXVyMjMxOTE0ODA@._V1_QL75_UX190_CR0,0,190,281_.jpg","In this action-packed comedy, Nicolas Cage plays Nick Cage, channeling his iconic characters as he's caught between a superfan (Pedro Pascal) and a CIA agent (Tiffany Haddish).",Action Comedy Crime
action,Nobody,"https://m.media-amazon.com/images/M/MV5BMjM5YTRlZmUtZGVmYi00ZjE2LWIyNzAtOWVhMDk1MDdkYzhjXkEyXkFqcGdeQXVyMjMxOTE0ODA@._V1_QL75_UX190_CR0,10,190,281_.jpg","A docile family man slowly reveals his true character after his house gets burgled by two petty thieves, which, coincidentally, leads him into a bloody war with a Russian crime boss.",Action Crime Drama
action,Ambulance,"https://m.media-amazon.com/images/M/MV5BYjUyN2VlZGEtNGEyZC00YjViLTgwYmQtZDJiM2FlOTU3Mjg2XkEyXkFqcGdeQXVyMjMxOTE0ODA@._V1_QL75_UX190_CR0,10,190,281_.jpg",Two robbers steal an ambulance after their heist goes awry.,Action Crime Drama
action,In the Dark,"https://m.media-amazon.com/images/M/MV5BMzk3NWVhMzgtNjkzMy00OWYxLWIxZDktZmIyODU5NjA5ZDE3XkEyXkFqcGdeQXVyMTUyNjM1OTE4._V1_QL75_UY281_CR11,0,190,281_.jpg",A blind young woman tries to solve her friend's murder.,Action Crime Horror
action,Morbius,"https://m.media-amazon.com/images/M/MV5BNTA3N2Q0ZTAtODJjNy00MmQzLWJlMmItOGFmNDI0ODgxN2QwXkEyXkFqcGdeQXVyMTM0NTUzNDIy._V1_QL75_UX190_CR0,2,190,281_.jpg","Biochemist Michael Morbius tries to cure himself of a rare blood disease, but he inadvertently infects himself with a form of vampirism instead.",Action Adventure Horror
action,Prison Break,"https://m.media-amazon.com/images/M/MV5BMTg3NTkwNzAxOF5BMl5BanBnXkFtZTcwMjM1NjI5MQ@@._V1_QL75_UY281_CR1,0,190,281_.jpg","Due to a political conspiracy, an innocent man is sent to death row and his only hope is his brother, who makes it his mission to deliberately get himself sent to the same prison in order to break the both of them out, from the inside.",Action Crime Drama
action,Banshee,"https://m.media-amazon.com/images/M/MV5BMTkzNTA1MDI5M15BMl5BanBnXkFtZTcwNTY3NjAwOQ@@._V1_QL75_UY281_CR0,0,190,281_.jpg","An ex-con assumes the identity of a murdered sheriff in the small town of Banshee, Pennsylvania, where he has some unfinished business.",Action Crime Drama
action,NCIS: Los Angeles,"https://m.media-amazon.com/images/M/MV5BMGQzNGIzNmEtNWE3ZS00OTUyLTg3YTEtMDY3NDViZWE0YWY1XkEyXkFqcGdeQXVyNjg4NzAyOTA@._V1_QL75_UX190_CR0,2,190,281_.jpg","The Naval Criminal Investigation Service's Office of Special Projects takes on the undercover work and the hard to crack cases in LA. Key agents are G. Callen and Sam Hanna, streets kids risen through the ranks.",Action Crime Drama
action,Walker,"https://m.media-amazon.com/images/M/MV5BNjM5ODI1NjItNjZhOC00ZTliLThiODMtMDg3YWM5YzljZWVkXkEyXkFqcGdeQXVyMTEyMjM2NDc2._V1_QL75_UX190_CR0,2,190,281_.jpg","A widowed father returns to Austin after one year, attempting to reconnect with his children, navigate clashes with his family, and find common ground with his new partner, while growing increasingly suspicious of his wife's death.",Action Crime Drama
action,Blade Runner 2049,"https://m.media-amazon.com/images/M/MV5BNzA1Njg4NzYxOV5BMl5BanBnXkFtZTgwODk5NjU3MzI@._V1_QL75_UX190_CR0,0,190,281_.jpg","Young Blade Runner K's discovery of a long-buried secret leads him to track down former Blade Runner Rick Deckard, who's been missing for thirty years.",Action Drama Mystery
action,Barry,"https://m.media-amazon.com/images/M/MV5BMzE0MDNiNDMtZTQ4Ni00MmQ4LTk4YzktZjFkYTVmODEzMDc2XkEyXkFqcGdeQXVyNTE1NjY5Mg@@._V1_QL75_UX190_CR0,0,190,281_.jpg",A hit man from the Midwest moves to Los Angeles and gets caught up in the city's theatre arts scene.,Action Comedy Crime
action,Monster High: The Movie,"https://m.media-amazon.com/images/M/MV5BNTQyOTBhOTctZjk4MC00MGM3LTg0YTAtNDlhYjYyYWYxMGJiXkEyXkFqcGdeQXVyODUwNjEzMzg@._V1_QL75_UY281_CR1,0,190,281_.jpg","Follows a half human and half werewolf, as she finally finds a place where she fits, but, when a devious plan to destroy Monster High threatens to reveal her identity, she must learn to embrace her true monster heart and save the day.",Action Adventure Fantasy
action,Tom Clancy's Jack Ryan,"https://m.media-amazon.com/images/M/MV5BNDNmNGI2NzAtZjZhYi00YTc1LWJjOTctMTRlMDI0MzEzNjA2XkEyXkFqcGdeQXVyMjkwOTAyMDU@._V1_QL75_UY281_CR0,0,190,281_.jpg","Up-and-coming CIA analyst, Jack Ryan, is thrust into a dangerous field assignment after he uncovers a pattern in terrorist communication that launches him into the center of a dangerous gambit.",Action Drama Thriller
action,Day Shift,"https://m.media-amazon.com/images/M/MV5BYWI2ZDRjYjEtOWJiOS00NWVjLWI1MjAtNWNiMzAwNGFmNjljXkEyXkFqcGdeQXVyODEwMTc2ODQ@._V1_QL75_UX190_CR0,0,190,281_.jpg","A hard-working, blue-collar dad just wants to provide a good life for his quick-witted 10-year-old daughter. His mundane San Fernando Valley pool cleaning job is a front for his real source of income: hunting and killing vampires.",Action Comedy Fantasy
action,Star Wars: Episode IX - The Rise of Skywalker,"https://m.media-amazon.com/images/M/MV5BMDljNTQ5ODItZmQwMy00M2ExLTljOTQtZTVjNGE2NTg0NGIxXkEyXkFqcGdeQXVyODkzNTgxMDg@._V1_QL75_UX190_CR0,0,190,281_.jpg","In the riveting conclusion of the landmark Skywalker saga, new legends will be born-and the final battle for freedom is yet to come.",Action Adventure Fantasy
action,Star Trek: Strange New Worlds,"https://m.media-amazon.com/images/M/MV5BYWNlYmZkZjQtNjU5OS00YTNkLWJmOTEtYmZiMmUwZGI3NTM3XkEyXkFqcGdeQXVyMTM2NTIwMDIw._V1_QL75_UX190_CR0,0,190,281_.jpg","A prequel to Star Trek: The Original Series, the show will follow the crew of the USS Enterprise under Captain Christopher Pike.",Action Adventure Sci-Fi
action,Vikram Vedha,"https://m.media-amazon.com/images/M/MV5BYTEyYjgzNmUtM2QyYi00MWMwLWExMDctZmY1NmZhNGY5MWNiXkEyXkFqcGdeQXVyOTcwMTQxMTM@._V1_QL75_UY281_CR18,0,190,281_.jpg",A tough police officer sets out to track down and kill an equally tough gangster.,Action Crime Drama
action,Samaritan,"https://m.media-amazon.com/images/M/MV5BY2M2MjMxNjUtZWU2MS00NTIwLWE0ZDEtOTY3NzY5NGZmY2RmXkEyXkFqcGdeQXVyODk2NDQ3MTA@._V1_QL75_UX190_CR0,0,190,281_.jpg",A young boy learns that a superhero who was thought to have gone missing after an epic battle twenty years ago may in fact still be around.,Action Drama Fantasy
action,Station 19,"https://m.media-amazon.com/images/M/MV5BOWY2NDE2NjktNTZkMi00MDNlLTliZTctYzY5OGJkMjYxOTI4XkEyXkFqcGdeQXVyMTkxNjUyNQ@@._V1_QL75_UY281_CR18,0,190,281_.jpg","This spinoff of the critically acclaimed show Grey's Anatomy follows the lives of the men and women of firehouse station 19 in Seattle, Washington.",Action Drama Romance
action,Demon Slayer: Kimetsu no Yaiba,"https://m.media-amazon.com/images/M/MV5BNzJhMDY2NzUtYzE2Ny00YWVmLWI3YjQtODk2ZWQzYmEwMzJiXkEyXkFqcGdeQXVyNjAwNDUxODI@._V1_QL75_UY281_CR4,0,190,281_.jpg","A family is attacked by demons and only two members survive - Tanjiro and his sister Nezuko, who is turning into a demon slowly. Tanjiro sets out to become a demon slayer to avenge his family and cure his sister.",Animation Action Adventure
action,"Love, Death & Robots","https://m.media-amazon.com/images/M/MV5BYTNiYTNkNTAtYzE3ZS00ZDQ1LWEwZTYtZjI1NzYzMWJjY2U4XkEyXkFqcGdeQXVyODk4OTc3MTY@._V1_QL75_UX190_CR0,0,190,281_.jpg","A collection of animated short stories that span various genres including science fiction, fantasy, horror and comedy.",Animation Short Action
action,Thirteen Lives,"https://m.media-amazon.com/images/M/MV5BNzI4YzkyMTYtYmQ1MC00NjYwLThkMDgtY2E1Njg1MTAzZWJhXkEyXkFqcGdeQXVyMDM2NDM2MQ@@._V1_QL75_UX190_CR0,0,190,281_.jpg",A rescue mission is assembled in Thailand where a group of young boys and their soccer coach are trapped in a system of underground caves that are flooding.,Action Adventure Biography
action,Star Trek: Discovery,"https://m.media-amazon.com/images/M/MV5BNjg1NTc2MDktZTU5Ni00OTZiLWIyNjQtN2FhNGY4MzAxNmZkXkEyXkFqcGdeQXVyMTkxNjUyNQ@@._V1_QL75_UX190_CR0,2,190,281_.jpg","Ten years before Kirk, Spock, and the Enterprise, the USS Discovery discovers new worlds and lifeforms as one Starfleet officer learns to understand all things alien.",Action Adventure Drama
action,Twister,"https://m.media-amazon.com/images/M/MV5BODExYTM0MzEtZGY2Yy00N2ExLTkwZjItNGYzYTRmMWZlOGEzXkEyXkFqcGdeQXVyNDk3NzU2MTQ@._V1_QL75_UX190_CR0,0,190,281_.jpg","Bill and Jo Harding, advanced storm chasers on the brink of divorce, must join together to create an advanced weather alert system by putting themselves in the cross-hairs of extremely violent tornadoes.",Action Adventure Thriller
action,Gladiator,"https://m.media-amazon.com/images/M/MV5BMDliMmNhNDEtODUyOS00MjNlLTgxODEtN2U3NzIxMGVkZTA1L2ltYWdlXkEyXkFqcGdeQXVyNjU0OTQ0OTY@._V1_QL75_UX190_CR0,0,190,281_.jpg",A former Roman General sets out to exact vengeance against the corrupt emperor who murdered his family and sent him into slavery.,Action Adventure Drama
action,Stargate SG-1,"https://m.media-amazon.com/images/M/MV5BMTc3MjEwMTc5N15BMl5BanBnXkFtZTcwNzQ2NjQ4NA@@._V1_QL75_UX190_CR0,2,190,281_.jpg","A secret military team, SG-1, is formed to explore other planets through the recently discovered Stargates.",Action Adventure Drama
action,Black Panther,"https://m.media-amazon.com/images/M/MV5BMTg1MTY2MjYzNV5BMl5BanBnXkFtZTgwMTc4NTMwNDI@._V1_QL75_UX190_CR0,0,190,281_.jpg","T'Challa, heir to the hidden but advanced kingdom of Wakanda, must step forward to lead his people into a new future and must confront a challenger from his country's past.",Action Adventure Sci-Fi
action,The Hunger Games,"https://m.media-amazon.com/images/M/MV5BMjA4NDg3NzYxMF5BMl5BanBnXkFtZTcwNTgyNzkyNw@@._V1_QL75_UX190_CR0,0,190,281_.jpg",Katniss Everdeen voluntarily takes her younger sister's place in the Hunger Games: a televised competition in which two teenagers from each of the twelve Districts of Panem are chosen at random to fight to the death.,Action Adventure Sci-Fi
action,Justified,"https://m.media-amazon.com/images/M/MV5BNzRjNGVhNDMtODI0ZS00NGNhLWE2MTctMGRkMzdhZmQ1YWY4XkEyXkFqcGdeQXVyNDIzMzcwNjc@._V1_QL75_UX190_CR0,0,190,281_.jpg","U.S. Marshal Raylan Givens is reassigned from Miami to his childhood home in the poor, rural coal mining towns of eastern Kentucky.",Action Crime Drama
action,Arrow,"https://m.media-amazon.com/images/M/MV5BMTI0NTMwMDgtYTMzZC00YmJhLTg4NzMtMTc1NjI4MWY4NmQ4XkEyXkFqcGdeQXVyNTY3MTYzOTA@._V1_QL75_UY281_CR18,0,190,281_.jpg","Spoiled billionaire playboy Oliver Queen is missing and presumed dead when his yacht is lost at sea. He returns five years later a changed man, determined to clean up the city as a hooded vigilante armed with a bow.",Action Adventure Crime
action,Moonfall,"https://m.media-amazon.com/images/M/MV5BZjk0OWZiN2ItNmQ2YS00NTJmLTg0MjItNzM4NzBkMWM1ZTRlXkEyXkFqcGdeQXVyMjMxOTE0ODA@._V1_QL75_UY281_CR4,0,190,281_.jpg",A mysterious force knocks the moon from its orbit and sends it hurtling on a collision course toward earth.,Action Adventure Sci-Fi
action,Shadow and Bone,"https://m.media-amazon.com/images/M/MV5BNTNhY2JlMmItMGMzZi00ZTM2LTlmNTItZDBkMGVhNGJhYWRhXkEyXkFqcGdeQXVyMTEyMjM2NDc2._V1_QL75_UY281_CR18,0,190,281_.jpg",Dark forces conspire against orphan mapmaker Alina Starkov when she unleashes an extraordinary power that could change the fate of her war-torn world.,Action Adventure Drama
action,Untitled Indiana Jones Project,"https://m.media-amazon.com/images/M/MV5BNjc5MDVjZDEtNjNjYi00OTM5LWFiMmQtODllOWI1YmZjYWI0XkEyXkFqcGdeQXVyNzEzNjU1NDg@._V1_QL75_UX190_CR0,2,190,281_.jpg",The plot is unknown at this time.,Action Adventure
action,Moon Knight,"https://m.media-amazon.com/images/M/MV5BYTc5OWNhYjktMThlOS00ODUxLTgwNDQtZjdjYjkyM2IwZTZlXkEyXkFqcGdeQXVyNTA3MTU2MjE@._V1_QL75_UX190_CR0,0,190,281_.jpg",Steven Grant discovers he's been granted the powers of an Egyptian moon god. But he soon finds out that these newfound powers can be both a blessing and a curse to his troubled life.,Action Adventure Fantasy
action,Stargirl,"https://m.media-amazon.com/images/M/MV5BYzEzZDVkZDUtY2ZkMS00NzcwLTkwMjEtZGYxZjU1Y2IxNGMwXkEyXkFqcGdeQXVyMTEyMjM2NDc2._V1_QL75_UY281_CR18,0,190,281_.jpg",Teenager Courtney Whitmore joins the Justice Society of America. Based on the character from DC Comics.,Action Adventure Crime
action,Bleach,"https://m.media-amazon.com/images/M/MV5BZjE0YjVjODQtZGY2NS00MDcyLThhMDAtZGQwMTZiOWNmNjRiXkEyXkFqcGdeQXVyNTA4NzY1MzY@._V1_QL75_UX190_CR0,2,190,281_.jpg","High school student Ichigo Kurosaki, who has the ability to see ghosts, gains soul reaper powers from Rukia Kuchiki and sets out to save the world from ""Hollows"".",Animation Action Adventure
action,Free Guy,"https://m.media-amazon.com/images/M/MV5BOTY2NzFjODctOWUzMC00MGZhLTlhNjMtM2Y2ODBiNGY1ZWRiXkEyXkFqcGdeQXVyMDM2NDM2MQ@@._V1_QL75_UY281_CR3,0,190,281_.jpg","A bank teller discovers that he's actually an NPC inside a brutal, open world video game.",Action Adventure Comedy
action,Hawaii Five-0,"https://m.media-amazon.com/images/M/MV5BOGMxNDUxMzMtNTgwZS00ZjVlLTkyNmUtNGEzYzQ0YjY3OTAxXkEyXkFqcGdeQXVyMTYzMDM0NTU@._V1_QL75_UX190_CR0,2,190,281_.jpg","When Steve McGarrett returns home to Oahu to find his father's killer, the Governor offers him the chance to run his own task force: Five-0.",Action Crime Drama
