genre,title,poster_link,description,labels
action,Blade,"https://m.media-amazon.com/images/M/MV5BOTk2NDNjZWQtMGY0Mi00YTY2LWE5MzctMGRhZmNlYzljYTg5XkEyXkFqcGdeQXVyMTAyNjg4NjE0._V1_QL75_UY281_CR7,0,190,281_.jpg","A half-vampire, half-mortal man becomes a protector of the mortal race, while slaying evil vampires.",Action Horror Sci-Fi
action,Pirates of the Caribbean: The Curse of the Black Pearl,"https://m.media-amazon.com/images/M/MV5BNGYyZGM5MGMtYTY2Ni00M2Y1LWIzNjQtYWUzM2VlNGVhMDNhXkEyXkFqcGdeQXVyMTMxODk2OTU@._V1_QL75_UX190_CR0,1,190,281_.jpg","Blacksmith Will Turner teams up with eccentric pirate ""Captain"" Jack Sparrow to save his love, the governor's daughter, from Jack's former pirate allies, who are now undead.",Action Adventure Fantasy
action,1917,"https://m.media-amazon.com/images/M/MV5BOTdmNTFjNDEtNzg0My00ZjkxLTg1ZDAtZTdkMDc2ZmFiNWQ1XkEyXkFqcGdeQXVyNTAzNzgwNTg@._V1_QL75_UX190_CR0,10,190,281_.jpg","April 6th, 1917. As an infantry battalion assembles to wage war deep in enemy territory, two soldiers are assigned to race against time and deliver a message that will stop 1,600 men from walking straight into a deadly trap.",Action Drama War
action,Harley Quinn,"https://m.media-amazon.com/images/M/MV5BNWRhMTVhNjgtZjcyMS00N2YzLWI2N2QtNTYwMGFlOTdmMGY1XkEyXkFqcGdeQXVyMjkyNzYwMTc@._V1_QL75_UX190_CR0,0,190,281_.jpg","The series focuses on a single Harley Quinn, who sets off to make it on her own in Gotham City.",Animation Action Adventure
action,The Karate Kid,"https://m.media-amazon.com/images/M/MV5BNTkzY2YzNmYtY2ViMS00MThiLWFlYTEtOWQ1OTBiOGEwMTdhXkEyXkFqcGdeQXVyMTQxNzMzNDI@._V1_QL75_UX190_CR0,8,190,281_.jpg",A martial arts master agrees to teach karate to a bullied teenager.,Action Drama Family
action,The Last Duel,"https://m.media-amazon.com/images/M/MV5BZGExZTUzYWQtYWJjZi00OTI4LTk4OGYtNTA2YzcwMmNiZTMxXkEyXkFqcGdeQXVyMTEyMjM2NDc2._V1_QL75_UX190_CR0,0,190,281_.jpg",King Charles VI declares that Knight Jean de Carrouges settle his dispute with his squire by challenging him to a duel.,Action Drama History
action,Robin Hood,"https://m.media-amazon.com/images/M/MV5BMTM5NzcwMzEwOF5BMl5BanBnXkFtZTcwNjg5MTgwMw@@._V1_QL75_UX190_CR0,0,190,281_.jpg","In twelfth-century England, Robin Longstride and his band of marauders confront corruption in a local village and lead an uprising against the crown that will forever alter the balance of world power.",Action Adventure Drama
action,Lightyear,"https://m.media-amazon.com/images/M/MV5BYTg2Zjk0ZTctM2ZmMi00MDRmLWJjOGYtNWM0YjBmZTBjMjRkXkEyXkFqcGdeQXVyMTM1MTE1NDMx._V1_QL75_UX190_CR0,0,190,281_.jpg","While spending years attempting to return home, marooned Space Ranger Buzz Lightyear encounters an army of ruthless robots commanded by Zurg who are attempting to steal his fuel source.",Animation Action Adventure
action,The Book of Boba Fett,"https://m.media-amazon.com/images/M/MV5BZjllZjE1MWEtYTJhZC00MWIyLTliMjEtYzM3ODc4YzQ2MjFlXkEyXkFqcGdeQXVyODIyOTEyMzY@._V1_QL75_UX190_CR0,0,190,281_.jpg",Bounty hunter Boba Fett and mercenary Fennec Shand navigate the underworld when they return to Tatooine to claim Jabba the Hutt's old turf.,Action Adventure Sci-Fi
action,The Imperfects,"https://m.media-amazon.com/images/M/MV5BODJhZTM2ZTEtN2E4OC00NGQ1LTlmMGMtZTAyYWI5ZjgwMzNkXkEyXkFqcGdeQXVyMTEzMTI1Mjk3._V1_QL75_UY281_CR18,0,190,281_.jpg","After an experimental gene therapy turns them into monsters, three twenty-somethings band together to hunt down the scientist responsible and force him to make them human again.",Action Adventure Drama
action,Harry Potter and the Order of the Phoenix,"https://m.media-amazon.com/images/M/MV5BMTM0NTczMTUzOV5BMl5BanBnXkFtZTYwMzIxNTg3._V1_QL75_UX190_CR0,0,190,281_.jpg","With their warning about Lord Voldemort's return scoffed at, Harry and Dumbledore are targeted by the Wizard authorities as an authoritarian bureaucrat slowly seizes power at Hogwarts.",Action Adventure Family
action,Harry Potter and the Half-Blood Prince,"https://m.media-amazon.com/images/M/MV5BNzU3NDg4NTAyNV5BMl5BanBnXkFtZTcwOTg2ODg1Mg@@._V1_QL75_UX190_CR0,6,190,281_.jpg","As Harry Potter begins his sixth year at Hogwarts, he discovers an old book marked as ""the property of the Half-Blood Prince"" and begins to learn more about Lord Voldemort's dark past.",Action Adventure Family
action,Vikings: Valhalla,"https://m.media-amazon.com/images/M/MV5BZjgwOGI3ZWEtNjBiMy00ZjM3LWFkNWYtNmU1MzY1ZGZkMDU2XkEyXkFqcGdeQXVyMTEyMjM2NDc2._V1_QL75_UX190_CR0,0,190,281_.jpg","Follow-up series to 'Vikings' set 100 years afterward and centering on the adventures of Leif Erikson, Freydis, Harald Hardrada and the Norman King William the Conqueror.",Action Adventure Drama
action,Blue Lock,"https://m.media-amazon.com/images/M/MV5BODBmM2JmY2EtMzRlZC00Njk0LTg5NGMtZjdjMjQ5ZTJhYWQ3XkEyXkFqcGdeQXVyMTMzNDExODE5._V1_QL75_UY281_CR6,0,190,281_.jpg","Japan keeps losing the World Cup, over and over. After Isagi Yoichi, a forward for a high school team, gets eliminated in the last game in the qualifier for nationals, gets invited to a program called ""Blue Lock"" Their coach will be Ego Jinpachi, who intends to ""destroy Japanese loser football"" by introducing a radical new training regimen: isolate 300 young forwards ...",Animation Action Mystery
action,GoldenEye,"https://m.media-amazon.com/images/M/MV5BMzk2OTg4MTk1NF5BMl5BanBnXkFtZTcwNjExNTgzNA@@._V1_QL75_UX190_CR0,2,190,281_.jpg","Years after a friend and fellow 00 agent is killed on a joint mission, a Russian crime syndicate steals a secret space-based weapons program known as ""GoldenEye"" and James Bond has to stop them from using it.",Action Adventure Thriller
action,Ms. Marvel,"https://m.media-amazon.com/images/M/MV5BZmQ3OTZkNDUtNTU0Mi00ZjE4LTgyNTUtY2E4NWRmNDUxMzkyXkEyXkFqcGdeQXVyMDM2NDM2MQ@@._V1_QL75_UX190_CR0,0,190,281_.jpg","Kamala is a superhero fan with an imagination, particularly when it comes to Captain Marvel; Kamala feels like she doesn't fit in at school and sometimes even at home, that is until she gets superpowers like the heroes she's looked up to.",Action Adventure Comedy
action,Hunter x Hunter,"https://m.media-amazon.com/images/M/MV5BNGM0YTk3MWEtN2JlZC00ZmZmLWIwMDktZTMxZGE5Zjc2MGExXkEyXkFqcGdeQXVyNjAwNDUxODI@._V1_QL75_UY281_CR4,0,190,281_.jpg","Gon Freecss aspires to become a Hunter, an exceptional being capable of greatness. With his friends and his potential, he seeks out his father, who left him when he was younger.",Animation Action Adventure
action,Baywatch,"https://m.media-amazon.com/images/M/MV5BMzhiMDcyNzMtYzY0MS00NTAwLWFlMDgtYzhhNDIyODYyNTBiXkEyXkFqcGdeQXVyMzI4MTk3MTY@._V1_QL75_UY281_CR2,0,190,281_.jpg","At a Los Angeles beach, a team of lifeguards led by Lieutenant Mitch Buchannon save lives, deal with personal dramas, fight crime and participate in over the top adventures on a daily basis.",Action Adventure Crime
action,Invincible,"https://m.media-amazon.com/images/M/MV5BMmE1ODVhMGYtODYyYS00Mjc4LWIzN2EtYWZkZDg1MTUyNDkxXkEyXkFqcGdeQXVyMTkxNjUyNQ@@._V1_QL75_UY281_CR1,0,190,281_.jpg",An adult animated series based on the Skybound/Image comic about a teenager whose father is the most powerful superhero on the planet.,Animation Action Adventure
action,Rome,"https://m.media-amazon.com/images/M/MV5BYTM4MmU1NWYtNzJjYy00YWFhLThjOGEtZmMxOGI1NzE0NGNiXkEyXkFqcGdeQXVyNDIzMzcwNjc@._V1_QL75_UX190_CR0,2,190,281_.jpg",A down-to-earth account of the lives of both illustrious and ordinary Romans set in the last days of the Roman Republic.,Action Drama History
action,The Dark Knight Rises,"https://m.media-amazon.com/images/M/MV5BMTk4ODQzNDY3Ml5BMl5BanBnXkFtZTcwODA0NTM4Nw@@._V1_QL75_UX190_CR0,0,190,281_.jpg","Eight years after the Joker's reign of anarchy, Batman, with the help of the enigmatic Selina Kyle, is forced from his exile to save Gotham City from the brutal guerrilla terrorist Bane.",Action Drama
action,Aliens,"https://m.media-amazon.com/images/M/MV5BZGU2OGY5ZTYtMWNhYy00NjZiLWI0NjUtZmNhY2JhNDRmODU3XkEyXkFqcGdeQXVyNzkwMjQ5NzM@._V1_QL75_UX190_CR0,7,190,281_.jpg","Fifty-seven years after surviving an apocalyptic attack aboard her space vessel by merciless space creatures, Officer Ripley awakens from hyper-sleep and tries to warn anyone who will listen about the predators.",Action Adventure Sci-Fi
action,Godfather,"https://m.media-amazon.com/images/M/MV5BYmIxMjM2N2MtYjJiMC00NDNmLWExMDEtZjYyYjIyNjMzMDEwXkEyXkFqcGdeQXVyOTI3MzI4MzA@._V1_QL75_UX190_CR0,2,190,281_.jpg","After the death of a political leader, a mysterious man steps in to ascend the throne.",Action Crime Drama
action,Mob Psycho 100,"https://m.media-amazon.com/images/M/MV5BYWIwZjhkMzgtOWExYi00ZGIwLTg1ZTktNjQyZWIxYWFmZTc0XkEyXkFqcGdeQXVyNjAwNDUxODI@._V1_QL75_UX190_CR0,2,190,281_.jpg","A psychic middle school boy tries to live a normal life and keep his growing powers under control, even though he constantly gets into trouble.",Animation Action Comedy
action,Guardians of the Galaxy,"https://m.media-amazon.com/images/M/MV5BZTkwZjU3MTctMGExMi00YjU5LTgwMDMtOWNkZDRlZjQ4NmZhXkEyXkFqcGdeQXVyNjAwNDUxODI@._V1_QL75_UX190_CR0,2,190,281_.jpg",A group of intergalactic criminals must pull together to stop a fanatical warrior with plans to purge the universe.,Action Adventure Comedy
action,The Flash,"https://m.media-amazon.com/images/M/MV5BOWNhMGU5MjEtMGVkYi00M2RiLWE5NjUtY2U5NDAxZTcwNDY0XkEyXkFqcGdeQXVyODk4OTc3MTY@._V1_QL75_UX190_CR0,0,190,281_.jpg","The plot is unknown. Feature film based on the comic book superhero, The Flash.",Action Adventure Fantasy
action,Spider-Man: Into the Spider-Verse,"https://m.media-amazon.com/images/M/MV5BMjMwNDkxMTgzOF5BMl5BanBnXkFtZTgwNTkwNTQ3NjM@._V1_QL75_UX190_CR0,0,190,281_.jpg","Teen Miles Morales becomes the Spider-Man of his universe, and must join with five spider-powered individuals from other dimensions to stop a threat for all realities.",Animation Action Adventure
action,Avengers: Secret Wars,"https://m.media-amazon.com/images/M/MV5BZWE0MjkyNGQtMjgwMS00NGIwLTg5YmEtYThlOTQ1NTZmNWFmXkEyXkFqcGdeQXVyMTEzMTI1Mjk3._V1_QL75_UX190_CR0,2,190,281_.jpg",Plot under wraps.,Action Adventure Sci-Fi
action,Spiderhead,"https://m.media-amazon.com/images/M/MV5BNDVkZTc4OTktNTAyOC00MzQxLThiZjMtM2M3MTlmYzFjY2FkXkEyXkFqcGdeQXVyMTkxNjUyNQ@@._V1_QL75_UX190_CR0,0,190,281_.jpg","In the near future, convicts are offered the chance to volunteer as medical subjects to shorten their sentence. One such subject for a new drug capable of generating feelings of love begins questioning the reality of his emotions.",Action Crime Drama
action,The Adam Project,"https://m.media-amazon.com/images/M/MV5BOWM0YWMwMDQtMjE5NS00ZTIwLWE1NWEtODViMWZjMWI2OTU3XkEyXkFqcGdeQXVyMTEyMjM2NDc2._V1_QL75_UY281_CR0,0,190,281_.jpg","After accidentally crash-landing in 2022, time-traveling fighter pilot Adam Reed teams up with his 12-year-old self for a mission to save the future.",Action Adventure Comedy
action,The Incredible Hulk,"https://m.media-amazon.com/images/M/MV5BMTUyNzk3MjA1OF5BMl5BanBnXkFtZTcwMTE1Njg2MQ@@._V1_QL75_UX190_CR0,0,190,281_.jpg","Bruce Banner, a scientist on the run from the U.S. Government, must find a cure for the monster he turns into whenever he loses his temper.",Action Adventure Sci-Fi
action,Layer Cake,"https://m.media-amazon.com/images/M/MV5BMTI5MTE1OTAzOV5BMl5BanBnXkFtZTcwNDc2OTgyMQ@@._V1_QL75_UX190_CR0,0,190,281_.jpg",A successful cocaine dealer gets two tough assignments from his boss on the eve of his planned early retirement.,Action Crime Drama
action,Dune: Part Two,"https://m.media-amazon.com/images/M/MV5BYjFkM2RhZjUtN2U0MC00NTMxLTk1MjktZDkwNjg3MjI0NmYxXkEyXkFqcGdeQXVyNTA3MTU2MjE@._V1_QL75_UX190_CR0,28,190,281_.jpg","This follow-up film will explore the mythic journey of Paul Atreides as he unites with Chani and the Fremen while on a warpath of revenge against the conspirators who destroyed his family. Facing a choice between the love of his life and the fate of the known universe, he endeavors to prevent a terrible future only he can foresee.",Action Adventure Drama
action,Jujutsu Kaisen,"https://m.media-amazon.com/images/M/MV5BNGY4MTg3NzgtMmFkZi00NTg5LWExMmEtMWI3YzI1ODdmMWQ1XkEyXkFqcGdeQXVyMjQwMDg0Ng@@._V1_QL75_UX190_CR0,2,190,281_.jpg",A boy swallows a cursed talisman - the finger of a demon - and becomes cursed himself. He enters a shaman's school to be able to locate the demon's other body parts and thus exorcise himself.,Animation Action Adventure
action,Blade of the 47 Ronin,"https://m.media-amazon.com/images/M/MV5BY2RkNWM0OWQtYmQxYi00ZjdlLTg4ZWItYTgwNjdlYzVlZjFmXkEyXkFqcGdeQXVyNjQ2MjQ4MzQ@._V1_QL75_UX190_CR0,2,190,281_.jpg","Ancient Japanese Ronin warriors set 300 years after 47 Ronin, in a modern-day world where Samurai clans exist in complete secrecy.",Action Drama Fantasy
action,Blade Runner,"https://m.media-amazon.com/images/M/MV5BNzQzMzJhZTEtOWM4NS00MTdhLTg0YjgtMjM4MDRkZjUwZDBlXkEyXkFqcGdeQXVyNjU0OTQ0OTY@._V1_QL75_UX190_CR0,1,190,281_.jpg","A blade runner must pursue and terminate four replicants who stole a ship in space, and have returned to Earth to find their creator.",Action Drama Sci-Fi
action,Iron Man,"https://m.media-amazon.com/images/M/MV5BMTczNTI2ODUwOF5BMl5BanBnXkFtZTcwMTU0NTIzMw@@._V1_QL75_UX190_CR0,0,190,281_.jpg","After being held captive in an Afghan cave, billionaire engineer Tony Stark creates a unique weaponized suit of armor to fight evil.",Action Adventure Sci-Fi
action,Kleo,"https://m.media-amazon.com/images/M/MV5BOWZmODY4YTgtMjE3Mi00YTBkLWJjMjctMDdkMjQzMzAyMDZiXkEyXkFqcGdeQXVyNTU1MzE3NDk@._V1_QL75_UY281_CR19,0,190,281_.jpg","After the fall of the Berlin Wall, a former spy killer is set free and embarks on a revenge spree against the people who conspired to betray her.",Action Crime Drama
action,Watchmen,"https://m.media-amazon.com/images/M/MV5BY2IzNGNiODgtOWYzOS00OTI0LTgxZTUtOTA5OTQ5YmI3NGUzXkEyXkFqcGdeQXVyNjU0OTQ0OTY@._V1_QL75_UX190_CR0,2,190,281_.jpg","In 1985 where former superheroes exist, the murder of a colleague sends active vigilante Rorschach into his own sprawling investigation, uncovering something that could completely change the course of history as we know it.",Action Drama Mystery
action,Star Trek,"https://m.media-amazon.com/images/M/MV5BMjE5NDQ5OTE4Ml5BMl5BanBnXkFtZTcwOTE3NDIzMw@@._V1_QL75_UX190_CR0,0,190,281_.jpg",The brash James T. Kirk tries to live up to his father's legacy with Mr. Spock keeping him in check as a vengeful Romulan from the future creates black holes to destroy the Federation one planet at a time.,Action Adventure Sci-Fi
action,Doom Patrol,"https://m.media-amazon.com/images/M/MV5BZWMxZWMxOTktYjU1Yi00ZmQyLTk0NzctYmM0MmU1YmYwZjc5XkEyXkFqcGdeQXVyMDM2NDM2MQ@@._V1_QL75_UX190_CR0,0,190,281_.jpg",The adventures of an idealistic mad scientist and his field team of superpowered outcasts.,Action Adventure Comedy
action,Black Widow,"https://m.media-amazon.com/images/M/MV5BNjRmNDI5MjMtMmFhZi00YzcwLWI4ZGItMGI2MjI0N2Q3YmIwXkEyXkFqcGdeQXVyMTkxNjUyNQ@@._V1_QL75_UX190_CR0,0,190,281_.jpg",Natasha Romanoff confronts the darker parts of her ledger when a dangerous conspiracy with ties to her past arises.,Action Adventure Sci-Fi
action,Ford v Ferrari,"https://m.media-amazon.com/images/M/MV5BM2UwMDVmMDItM2I2Yi00NGZmLTk4ZTUtY2JjNTQ3OGQ5ZjM2XkEyXkFqcGdeQXVyMTA1OTYzOTUx._V1_QL75_UY281_CR0,0,190,281_.jpg",American car designer Carroll Shelby and driver Ken Miles battle corporate interference and the laws of physics to build a revolutionary race car for Ford in order to defeat Ferrari at the 24 Hours of Le Mans in 1966.,Action Biography Drama
action,Wrath of Man,"https://m.media-amazon.com/images/M/MV5BNGVkOTlhOTktNjZiNS00NDg3LWIxMDAtZTY5Y2E0YjllN2IxXkEyXkFqcGdeQXVyMTkxNjUyNQ@@._V1_QL75_UX190_CR0,0,190,281_.jpg","The plot follows H, a cold and mysterious character working at a cash truck company responsible for moving hundreds of millions of dollars around Los Angeles each week.",Action Crime Thriller
action,Scorpion,"https://m.media-amazon.com/images/M/MV5BYmY2MjY2MGQtYjhjZi00OGY3LWFjMWUtMGQxZmUyODkzZmVkXkEyXkFqcGdeQXVyNjg4NzAyOTA@._V1_QL75_UX190_CR0,2,190,281_.jpg",An eccentric genius forms an international network of super-geniuses to act as the last line of defense against the complicated threats of the modern world.,Action Crime Drama
action,Drive,"https://m.media-amazon.com/images/M/MV5BZjY5ZjQyMjMtMmEwOC00Nzc2LTllYTItMmU2MzJjNTg1NjY0XkEyXkFqcGdeQXVyNjQ1MTMzMDQ@._V1_QL75_UX190_CR0,0,190,281_.jpg","A mysterious Hollywood action film stuntman who moonlights as a getaway driver, gets in trouble with gangsters when he tries to help his neighbor's husband rob a pawn shop while serving as his getaway driver,",Action Drama
action,Bullitt,"https://m.media-amazon.com/images/M/MV5BMGRjYzhmMGUtZjAyNy00NDkwLWI2ZmItMzJjYmYwM2JkYjkzXkEyXkFqcGdeQXVyMjUzOTY1NTc@._V1_QL75_UX190_CR0,0,190,281_.jpg","An all-guts, no-glory San Francisco cop becomes determined to find the underworld kingpin that killed the witness in his protection.",Action Crime Thriller
action,Outer Banks,"https://m.media-amazon.com/images/M/MV5BODRkZDYyMmUtYWE3MS00NzBkLWI3ZWYtMDU4YTUzODQwN2Y3XkEyXkFqcGdeQXVyMzQ2MDI5NjU@._V1_QL75_UX190_CR0,0,190,281_.jpg",A group of teenagers from the wrong side of the tracks stumble upon a treasure map that unearths a long-buried secret.,Action Crime Drama
action,Logan,"https://m.media-amazon.com/images/M/MV5BYzc5MTU4N2EtYTkyMi00NjdhLTg3NWEtMTY4OTEyMzJhZTAzXkEyXkFqcGdeQXVyNjc1NTYyMjg@._V1_QL75_UX190_CR0,2,190,281_.jpg","In a future where mutants are nearly extinct, an elderly and weary Logan leads a quiet life. But when Laura, a mutant child pursued by scientists, comes to him for help, he must get her to safety.",Action Drama Sci-Fi
action,The Warriors,"https://m.media-amazon.com/images/M/MV5BYTU2MWRiMTMtYzAzZi00NGYzLTlkMDEtNWQ3MzZlNTJlNzZkL2ltYWdlL2ltYWdlXkEyXkFqcGdeQXVyNjc1NTYyMjg@._V1_QL75_UX190_CR0,4,190,281_.jpg",A street gang known as The Warriors must fight their way from the Bronx to their home turf on Coney Island when they are falsely accused of assassinating a respected gang leader.,Action Crime Thriller
action,Megamind,"https://m.media-amazon.com/images/M/MV5BMTAzMzI0NTMzNDBeQTJeQWpwZ15BbWU3MDM3NTAyOTM@._V1_QL75_UX190_CR0,8,190,281_.jpg","Evil genius Megamind finally defeats his do-gooder nemesis, Metro Man, but is left without a purpose in a superhero-free world.",Animation Action Comedy
action,Naruto: Shippûden,"https://m.media-amazon.com/images/M/MV5BZGFiMWFhNDAtMzUyZS00NmQ2LTljNDYtMmZjNTc5MDUxMzViXkEyXkFqcGdeQXVyNjAwNDUxODI@._V1_QL75_UY281_CR4,0,190,281_.jpg","Naruto Uzumaki, is a loud, hyperactive, adolescent ninja who constantly searches for approval and recognition, as well as to become Hokage, who is acknowledged as the leader and strongest of all ninja in the village.",Animation Action Adventure
action,Red Notice,"https://m.media-amazon.com/images/M/MV5BZmRjODgyMzEtMzIxYS00OWY2LTk4YjUtMGMzZjMzMTZiN2Q0XkEyXkFqcGdeQXVyMTkxNjUyNQ@@._V1_QL75_UX190_CR0,0,190,281_.jpg","An Interpol agent successfully tracks down the world's most wanted art thief, with help from a rival thief. But nothing is as it seems, as a series of double-crosses ensue.",Action Comedy Thriller
action,Longmire,"https://m.media-amazon.com/images/M/MV5BMTcxMzIwNzI3M15BMl5BanBnXkFtZTgwODgxMTU5OTE@._V1_QL75_UX190_CR0,0,190,281_.jpg","Walt Longmire is the dedicated and unflappable sheriff of Absaroka County, Wyoming. Widowed only a year, he is a man in psychic repair but buries his pain behind his brave face, unassuming grin and dry wit.",Action Crime Drama
action,Code Name: Tiranga,"https://m.media-amazon.com/images/M/MV5BNjlkOWNiYmUtM2NhMi00NGNiLTg5ZjktMDg1N2FlODc1ZWZlXkEyXkFqcGdeQXVyOTI3MzI4MzA@._V1_QL75_UY281_CR18,0,190,281_.jpg",The story of a spy on an unfaltering and fearless mission for her nation in a race against time where sacrifice is her only choice.,Action Drama Thriller
action,V for Vendetta,"https://m.media-amazon.com/images/M/MV5BOTI5ODc3NzExNV5BMl5BanBnXkFtZTcwNzYxNzQzMw@@._V1_QL75_UX190_CR0,0,190,281_.jpg","In a future British dystopian society, a shadowy freedom fighter, known only by the alias of ""V"", plots to overthrow the tyrannical government - with the help of a young woman.",Action Drama Sci-Fi
action,Magnum P.I.,"https://m.media-amazon.com/images/M/MV5BMzMzMGZjYjktNzNiMi00MDEyLWEyYzAtOWJmZTY1NGUyNTkzXkEyXkFqcGdeQXVyMjYwNDA2MDE@._V1_QL75_UY281_CR1,0,190,281_.jpg",An ex-Navy SEAL returns from Afghanistan and uses his military skills to become a private investigator in Hawaii.,Action Adventure Crime
action,Wonder Woman,"https://m.media-amazon.com/images/M/MV5BMTYzODQzYjQtNTczNC00MzZhLTg1ZWYtZDUxYmQ3ZTY4NzA1XkEyXkFqcGdeQXVyODE5NzE3OTE@._V1_QL75_UX190_CR0,0,190,281_.jpg","When a pilot crashes and tells of conflict in the outside world, Diana, an Amazonian warrior in training, leaves home to fight a war, discovering her full powers and true destiny.",Action Adventure Fantasy
action,Guardians of the Galaxy Vol. 3,"https://m.media-amazon.com/images/M/MV5BNmVhN2IyMTUtZTg3ZS00YWYxLTg3OTItMTFlNGM0MDYyNWI3XkEyXkFqcGdeQXVyODk4OTc3MTY@._V1_QL75_UX190_CR0,0,190,281_.jpg","Still reeling from the loss of Gamora, Peter Quill rallies his team to defend the universe and one of their own - a mission that could mean the end of the Guardians if not successful.",Action Adventure Comedy
action,Tales of the Jedi,"https://m.media-amazon.com/images/M/MV5BODMwYmE1ZGItYWVjNi00ZWUxLWFjYjQtNjdjN2MzNzY0NmRlXkEyXkFqcGdeQXVyMTUzMTg2ODkz._V1_QL75_UX190_CR0,0,190,281_.jpg",It showcases animated shorts that feature Jedi from the prequel era.,Animation Short Action
action,Naruto,"https://m.media-amazon.com/images/M/MV5BMDI3ZDY4MDgtN2U2OS00Y2YzLWJmZmYtZWMzOTM3YWFjYmUyXkEyXkFqcGdeQXVyNjAwNDUxODI@._V1_QL75_UY281_CR8,0,190,281_.jpg","Naruto Uzumaki, a mischievous adolescent ninja, struggles as he searches for recognition and dreams of becoming the Hokage, the village's leader and strongest ninja.",Animation Action Adventure
action,The Fifth Element,"https://m.media-amazon.com/images/M/MV5BZWFjYmZmZGQtYzg4YS00ZGE5LTgwYzAtZmQwZjQ2NDliMGVmXkEyXkFqcGdeQXVyNTUyMzE4Mzg@._V1_QL75_UY281_CR3,0,190,281_.jpg","In the colorful future, a cab driver unwittingly becomes the central figure in the search for a legendary cosmic weapon to keep Evil and Mr. Zorg at bay.",Action Adventure Sci-Fi
action,Kill Bill: Vol. 1,"https://m.media-amazon.com/images/M/MV5BNzM3NDFhYTAtYmU5Mi00NGRmLTljYjgtMDkyODQ4MjNkMGY2XkEyXkFqcGdeQXVyNzkwMjQ5NzM@._V1_QL75_UX190_CR0,2,190,281_.jpg","After awakening from a four-year coma, a former assassin wreaks vengeance on the team of assassins who betrayed her.",Action Crime Drama
action,Poker Face,"https://m.media-amazon.com/images/M/MV5BNTc1NzUxMzQtZjc4YS00MmFjLWI5YmItMTNiYWM3ZjQ0YTFjXkEyXkFqcGdeQXVyNTc3MjM3OTA@._V1_QL75_UY281_CR4,0,190,281_.jpg","A tech billionaire hosts a high-stakes poker game between friends, but the evening takes a turn when long-held secrets are revealed, an elaborate revenge plot unfolds, and thieves break in.",Action Crime Thriller
action,The Avengers,"https://m.media-amazon.com/images/M/MV5BNDYxNjQyMjAtNTdiOS00NGYwLWFmNTAtNThmYjU5ZGI2YTI1XkEyXkFqcGdeQXVyMTMxODk2OTU@._V1_QL75_UX190_CR0,0,190,281_.jpg",Earth's mightiest heroes must come together and learn to fight as a team if they are going to stop the mischievous Loki and his alien army from enslaving humanity.,Action Adventure Sci-Fi
action,The Nevers,"https://m.media-amazon.com/images/M/MV5BODEyOWY2ZDctOGI3Zi00YjYwLWIwZDEtMzJlY2VhYTA2N2ViXkEyXkFqcGdeQXVyMTEyMjM2NDc2._V1_QL75_UX190_CR0,0,190,281_.jpg","An epic tale following a gang of Victorian women who find themselves with unusual abilities, relentless enemies, and a mission that might change the world.",Action Drama Fantasy
action,Batman Begins,"https://m.media-amazon.com/images/M/MV5BOTY4YjI2N2MtYmFlMC00ZjcyLTg3YjEtMDQyM2ZjYzQ5YWFkXkEyXkFqcGdeQXVyMTQxNzMzNDI@._V1_QL75_UY281_CR0,0,190,281_.jpg","After training with his mentor, Batman begins his fight to free crime-ridden Gotham City from corruption.",Action Crime Drama
action,Tomb Raider,"https://m.media-amazon.com/images/M/MV5BOTY4NDcyZGQtYmVlNy00ODgwLTljYTMtYzQ2OTE3NDhjODMwXkEyXkFqcGdeQXVyNzYzODM3Mzg@._V1_QL75_UX190_CR0,0,190,281_.jpg","Lara Croft (Alicia Vikander), the fiercely independent daughter of a missing adventurer, must push herself beyond her limits when she discovers the island where her father, Lord Richard Croft (Dominic West) disappeared.",Action Adventure Fantasy
action,RoboCop,"https://m.media-amazon.com/images/M/MV5BZWVlYzU2ZjQtZmNkMi00OTc3LTkwZmYtZDVjNmY4OWFmZGJlXkEyXkFqcGdeQXVyMTQxNzMzNDI@._V1_QL75_UX190_CR0,7,190,281_.jpg","In a dystopic and crime-ridden Detroit, a terminally wounded cop returns to the force as a powerful cyborg haunted by submerged memories.",Action Crime Sci-Fi
action,Spectre,"https://m.media-amazon.com/images/M/MV5BOWQ1MDE1NzgtNTQ4OC00ZjliLTllZDAtN2IyOTVmMTc5YjUxXkEyXkFqcGdeQXVyNzkwMjQ5NzM@._V1_QL75_UX190_CR0,0,190,281_.jpg","A cryptic message from James Bond's past sends him on a trail to uncover the existence of a sinister organisation named SPECTRE. With a new threat dawning, Bond learns the terrible truth about the author of all his pain in his most recent missions.",Action Adventure Thriller
action,From Dusk Till Dawn,"https://m.media-amazon.com/images/M/MV5BZjk3YmZhMDAtOWUzMS00YjE5LTkxNzAtY2I1NGZjMDA2ZTk0XkEyXkFqcGdeQXVyMTQxNzMzNDI@._V1_QL75_UX190_CR0,2,190,281_.jpg","Two criminals and their hostages unknowingly seek temporary refuge in a truck stop populated by vampires, with chaotic results.",Action Crime Horror
action,Angel,"https://m.media-amazon.com/images/M/MV5BODU0M2NjZjgtZmQ1Zi00OWIyLTg1ODctMTg4Njg0MmE5YzU4XkEyXkFqcGdeQXVyNzA5NjUyNjM@._V1_QL75_UY281_CR11,0,190,281_.jpg","The vampire Angel, cursed with a soul, moves to Los Angeles and aids people with supernatural-related problems while questing for his own redemption.",Action Drama Fantasy
