genre,title,poster_link,description,labels
action,Spartacus,"https://m.media-amazon.com/images/M/MV5BZWQ4MjA2YzEtOTQzYi00NWQ1LWI0ZDEtN2VkZjhmYTc3MzU0XkEyXkFqcGdeQXVyNDIzMzcwNjc@._V1_QL75_UX190_CR0,0,190,281_.jpg","The life of Spartacus, the gladiator who lead a rebellion against the Romans. From his time as an ally of the Romans, to his betrayal and becoming a gladiator, to the rebellion he leads and its ultimate outcome.",Action Adventure Biography
action,Star Trek: Picard,"https://m.media-amazon.com/images/M/MV5BMzY3MTcyNTktZGY0Yy00MmNhLTllYjQtMWFkNGM1YzNiOWRkXkEyXkFqcGdeQXVyODk4OTc3MTY@._V1_QL75_UX190_CR0,0,190,281_.jpg",Follow-up series to Star Trek: The Next Generation (1987) and Star Trek: Nemesis (2002) that centers on Jean-Luc Picard in the next chapter of his life.,Action Adventure Drama
action,Sonic the Hedgehog 2,"https://m.media-amazon.com/images/M/MV5BODRlNTY5ZjktZjE0Ni00YjZhLTk3NTItYzk0ZjYxN2QxMWEzXkEyXkFqcGdeQXVyMjMwNDgzNjc@._V1_QL75_UY281_CR0,0,190,281_.jpg","When the manic Dr Robotnik returns to Earth with a new ally, Knuckles the Echidna, Sonic and his new friend Tails is all that stands in their way.",Action Adventure Comedy
action,The Suicide Squad,"https://m.media-amazon.com/images/M/MV5BMWU4NDQ2NjEtNjhkOS00Y2MwLWJkODItZmJhZGE0MDU1OWM4XkEyXkFqcGdeQXVyODE5NzE3OTE@._V1_QL75_UX190_CR0,0,190,281_.jpg","Supervillains Harley Quinn, Bloodsport, Peacemaker, and a collection of nutty cons at Belle Reve prison join the super-secret, super-shady Task Force X as they are dropped off at the remote, enemy-infused island of Corto Maltese.",Action Adventure Comedy
action,Jurassic Park,"https://m.media-amazon.com/images/M/MV5BMjM2MDgxMDg0Nl5BMl5BanBnXkFtZTgwNTM2OTM5NDE@._V1_QL75_UX190_CR0,2,190,281_.jpg",A pragmatic paleontologist touring an almost complete theme park on an island in Central America is tasked with protecting a couple of kids after a power failure causes the park's cloned dinosaurs to run loose.,Action Adventure Sci-Fi
action,Violent Night,"https://m.media-amazon.com/images/M/MV5BYzg2NWNhOWItYjA3Yi00MzhhLTg4ZmItYzM3ZTIwN2U0ZGQ5XkEyXkFqcGdeQXVyMzEyMDQzNzY@._V1_QL75_UY281_CR18,0,190,281_.jpg","When a group of mercenaries attack the estate of a wealthy family, Santa Claus must step in to save the day (and Christmas).",Action Comedy Crime
action,Chuck,"https://m.media-amazon.com/images/M/MV5BMTM0ODIwNjI3NF5BMl5BanBnXkFtZTcwODU2ODUzMw@@._V1_QL75_UY281_CR11,0,190,281_.jpg","When a computer geek inadvertently downloads critical government secrets into his brain, both the CIA and the NSA assign an agent to protect him and exploit his newfound skills.",Action Comedy Drama
action,Squid Game,"https://m.media-amazon.com/images/M/MV5BYWE3MDVkN2EtNjQ5MS00ZDQ4LTliNzYtMjc2YWMzMDEwMTA3XkEyXkFqcGdeQXVyMTEzMTI1Mjk3._V1_QL75_UX190_CR0,0,190,281_.jpg","Hundreds of cash-strapped players accept a strange invitation to compete in children's games. Inside, a tempting prize awaits with deadly high stakes. A survival game that has a whopping 45.6 billion-won prize at stake.",Action Drama Mystery
action,Star Trek: The Original Series,"https://m.media-amazon.com/images/M/MV5BNDRkMTNiNjgtZDIyOC00NmE1LTlkZjEtMGZiNTcyZDQ0NjcxXkEyXkFqcGdeQXVyNTE1NjY5Mg@@._V1_QL75_UY281_CR5,0,190,281_.jpg","In the 23rd Century, Captain James T. Kirk and the crew of the U.S.S. Enterprise explore the galaxy and defend the United Federation of Planets.",Action Adventure Sci-Fi
action,Peacemaker,"https://m.media-amazon.com/images/M/MV5BODk2NjAyOWMtM2FjZC00MjZhLTkxMjQtZTM3NjJlYTE5MDdlXkEyXkFqcGdeQXVyMTkxNjUyNQ@@._V1_QL75_UX190_CR0,0,190,281_.jpg","Picking up where The Suicide Squad (2021) left off, Peacemaker returns home after recovering from his encounter with Bloodsport - only to discover that his freedom comes at a price.",Action Adventure Comedy
action,The Punisher,"https://m.media-amazon.com/images/M/MV5BNjJhZDZhNWYtMjdhYS00NjkyLWE5NzItMzljNmQ3NGE4MGZjXkEyXkFqcGdeQXVyMjkwOTAyMDU@._V1_QL75_UY281_CR11,0,190,281_.jpg","After his revenge on those who murdered his family, aimless Marine veteran Frank Castle finds a new meaning in life as a vigilante known as ""The Punisher"".",Action Crime Drama
action,Sita Ramam,"https://m.media-amazon.com/images/M/MV5BN2RjZDJhYzUtOTQ5Yy00OWM3LWE5OTctM2Y0YWVmNzAzODllXkEyXkFqcGdeQXVyMTA3MDk2NDg2._V1_QL75_UX190_CR0,2,190,281_.jpg","An orphan soldier, Lieutenant Ram's life changes, after he gets a letter from a girl named Sita. He meets her and love blossoms between them. When he comes back to his camp in Kashmir,After he gets caught in jail, he sends a letter to Sita which won't reach her.",Action Drama Mystery
action,Accident Man,"https://m.media-amazon.com/images/M/MV5BMzZiY2JhNmMtYjA2MS00NTQ4LWI4MDctZmQ1NTY3OWI4YTc0XkEyXkFqcGdeQXVyMzYxOTQ3MDg@._V1_QL75_UX190_CR0,0,190,281_.jpg","Mike is a tough hitman, who makes his hits look like accidents or suicide. He's in a gang of hitmen, each with his own style. When his loved ex is killed, Mike looks for those responsible.",Action Crime Thriller
action,Loki,"https://m.media-amazon.com/images/M/MV5BNTkwOTE1ZDYtODQ3Yy00YTYwLTg0YWQtYmVkNmFjNGZlYmRiXkEyXkFqcGdeQXVyNTc4MjczMTM@._V1_QL75_UX190_CR0,0,190,281_.jpg",The mercurial villain Loki resumes his role as the God of Mischief in a new series that takes place after the events of “Avengers: Endgame.”,Action Adventure Fantasy
action,The Last of Us,"https://m.media-amazon.com/images/M/MV5BZmE4NDVlMDEtYjg0OS00OTVmLTg3YjItNWE4MjFhZWEzMGUwXkEyXkFqcGdeQXVyNTExODM0NDI@._V1_QL75_UY281_CR125,0,190,281_.jpg","Joel and Ellie, a pair connected through the harshness of the world they live in, are forced to endure brutal circumstances and ruthless killers on a trek across post-pandemic America.",Action Adventure Drama
action,SPY×FAMILY,"https://m.media-amazon.com/images/M/MV5BMWM4Njg2MjUtODU3OS00MGNmLWIyNTctZGZkNTdjN2JhNmU2XkEyXkFqcGdeQXVyMTMzNDExODE5._V1_QL75_UX190_CR0,2,190,281_.jpg","A spy on an undercover mission gets married and adopts a child as part of his cover. His wife and daughter have secrets of their own, and all three must strive to keep together.",Animation Action Comedy
action,Teen Wolf,"https://m.media-amazon.com/images/M/MV5BMThlNTk3YzMtOTZjMi00M2NiLTg1NTgtYThiYzE2MDFmMDUwXkEyXkFqcGdeQXVyNzA5NjUyNjM@._V1_QL75_UX190_CR0,2,190,281_.jpg",An average high school student and his best friend get caught up in some trouble causing him to receive a werewolf bite. As a result they find themselves in the middle of all sorts of dramas in Beacon Hills.,Action Drama Fantasy
action,Deadpool,"https://m.media-amazon.com/images/M/MV5BYzE5MjY1ZDgtMTkyNC00MTMyLThhMjAtZGI5OTE1NzFlZGJjXkEyXkFqcGdeQXVyNjU0OTQ0OTY@._V1_QL75_UX190_CR0,2,190,281_.jpg","A wisecracking mercenary gets experimented on and becomes immortal but ugly, and sets out to track down the man who ruined his looks.",Action Adventure Comedy
action,Léon: The Professional,"https://m.media-amazon.com/images/M/MV5BOTgyMWQ0ZWUtN2Q2MS00NmY0LWI3OWMtNjFkMzZlNDZjNTk0XkEyXkFqcGdeQXVyMjUzOTY1NTc@._V1_QL75_UX190_CR0,1,190,281_.jpg","12-year-old Mathilda is reluctantly taken in by Léon, a professional assassin, after her family is murdered. An unusual relationship forms as she becomes his protégée and learns the assassin's trade.",Action Crime Drama
action,Ready Player One,"https://m.media-amazon.com/images/M/MV5BY2JiYTNmZTctYTQ1OC00YjU4LWEwMjYtZjkwY2Y5MDI0OTU3XkEyXkFqcGdeQXVyNTI4MzE4MDU@._V1_QL75_UX190_CR0,0,190,281_.jpg","When the creator of a virtual reality called the OASIS dies, he makes a posthumous challenge to all OASIS users to find his Easter Egg, which will give the finder his fortune and control of his world.",Action Adventure Sci-Fi
action,Halo,"https://m.media-amazon.com/images/M/MV5BYmY5YmJiM2QtNjdhOC00NjRhLTgyNDEtYmM1NmJhNjc5NDE2XkEyXkFqcGdeQXVyMjQ4ODcxNTM@._V1_QL75_UX190_CR0,0,190,281_.jpg",Aliens threaten human existence in an epic 26th-century showdown.,Action Adventure Sci-Fi
action,Person of Interest,"https://m.media-amazon.com/images/M/MV5BZDU1NzA5YzUtNTdmNy00NTVjLWFhNzEtYWI1NmNkNTA1ZDBhXkEyXkFqcGdeQXVyNTA4NzY1MzY@._V1_QL75_UY281_CR1,0,190,281_.jpg","An ex-CIA agent and a wealthy programmer save lives via a surveillance AI that sends them the identities of civilians involved in impending crimes. However, the details of the crimes, including the civilians' roles, are left a mystery.",Action Crime Drama
action,Ready or Not,"https://m.media-amazon.com/images/M/MV5BYzBkMzAyMDUtZTFkZS00OWUyLTgwM2ItNGI3MTQ5NzA3NTVkXkEyXkFqcGdeQXVyMTkxNjUyNQ@@._V1_QL75_UX190_CR0,1,190,281_.jpg",A bride's wedding night takes a sinister turn when her eccentric new in-laws force her to take part in a terrifying game.,Action Comedy Horror
action,Enola Holmes 2,"https://m.media-amazon.com/images/M/MV5BMDI1NWM1ZDItNDFhMi00YWRhLTg1YzItNTNhY2M2N2QzY2FkXkEyXkFqcGdeQXVyMTEyMjM2NDc2._V1_QL75_UX190_CR0,0,190,281_.jpg","Now a detective-for-hire, Enola Holmes takes on her first official case to find a missing girl as the sparks of a dangerous conspiracy ignite a mystery that requires the help of friends - and Sherlock himself - to unravel",Action Adventure Crime
action,Casino Royale,"https://m.media-amazon.com/images/M/MV5BYmI3MmMzMGMtNzc4Ni00YWQ4LWFkMDYtNjVlOWU3ZGZiNjY1XkEyXkFqcGdeQXVyNDQ2MTMzODA@._V1_QL75_UX190_CR0,0,190,281_.jpg","After earning 00 status and a licence to kill, secret agent James Bond sets out on his first mission as 007. Bond must defeat a private banker funding terrorists in a high-stakes game of poker at Casino Royale, Montenegro.",Action Adventure Thriller
action,Road House,"https://m.media-amazon.com/images/M/MV5BMTU1MTE2Mjk2OF5BMl5BanBnXkFtZTcwMTUzNjYzNA@@._V1_QL75_UX190_CR0,2,190,281_.jpg",A tough bouncer is hired to tame a dirty bar.,Action Thriller
action,Ant-Man and the Wasp: Quantumania,"https://m.media-amazon.com/images/M/MV5BNDgyNGM4NTYtN2M3MS00YTY2LTk0OWUtZmIzYjg3MmQ0OGM4XkEyXkFqcGdeQXVyODk4OTc3MTY@._V1_QL75_UX190_CR0,0,190,281_.jpg","Scott Lang and Hope Van Dyne, along with Hank Pym and Janet Van Dyne, explore the Quantum Realm, where they interact with strange creatures and embark on an adventure that goes beyond the limits of what they thought was possible.",Action Adventure Comedy
action,The Matrix,"https://m.media-amazon.com/images/M/MV5BNzQzOTk3OTAtNDQ0Zi00ZTVkLWI0MTEtMDllZjNkYzNjNTc4L2ltYWdlXkEyXkFqcGdeQXVyNjU0OTQ0OTY@._V1_QL75_UX190_CR0,2,190,281_.jpg","When a beautiful stranger leads computer hacker Neo to a forbidding underworld, he discovers the shocking truth--the life he knows is the elaborate deception of an evil cyber-intelligence.",Action Sci-Fi
action,FBI: International,"https://m.media-amazon.com/images/M/MV5BNzhiOGM5OTktYjNlYy00MTZlLTkwYmMtNTlkZjc5MWE0ZTRiXkEyXkFqcGdeQXVyMzU5ODEzMDU@._V1_QL75_UY281_CR11,0,190,281_.jpg",Elite agents of the FBI's International division travel the world with the mission of protecting Americans wherever they may be.,Action Adventure Crime
action,The Mummy,"https://m.media-amazon.com/images/M/MV5BOTJiYjBhZDgtMjhiOC00MTIzLThlNGMtMmI1NjIwM2M3YTI5XkEyXkFqcGdeQXVyMTQxNzMzNDI@._V1_QL75_UX190_CR0,1,190,281_.jpg","At an archaeological dig in the ancient city of Hamunaptra, an American serving in the French Foreign Legion accidentally awakens a mummy who begins to wreak havoc as he searches for the reincarnation of his long-lost love.",Action Adventure Fantasy
action,Eternals,"https://m.media-amazon.com/images/M/MV5BY2Y1ODBhYTItYmJiZi00NjU2LWI2NjktNTcwM2U2NGQ2ZTNiXkEyXkFqcGdeQXVyMTkxNjUyNQ@@._V1_QL75_UX190_CR0,0,190,281_.jpg","The saga of the Eternals, a race of immortal beings who lived on Earth and shaped its history and civilizations.",Action Adventure Fantasy
action,Point Break,"https://m.media-amazon.com/images/M/MV5BNWVjZWFmYjItZGJlOC00YTllLWE4YjctMWY2ZTg5ZjE0MDIyXkEyXkFqcGdeQXVyNDk3NzU2MTQ@._V1_QL75_UX190_CR0,0,190,281_.jpg",An F.B.I. Agent goes undercover to catch a gang of surfers who may be bank robbers.,Action Crime Thriller
action,Man of Steel,"https://m.media-amazon.com/images/M/MV5BMTk5ODk1NDkxMF5BMl5BanBnXkFtZTcwNTA5OTY0OQ@@._V1_QL75_UY281_CR0,0,190,281_.jpg",An alien child is evacuated from his dying world and sent to Earth to live among humans. His peace is threatened when other survivors of his home planet invade Earth.,Action Adventure Sci-Fi
action,Little Women,"https://m.media-amazon.com/images/M/MV5BMzRlZjkwOWEtMjBhMy00NmM3LWFkMzgtYTFmODIyMWFhNDkyXkEyXkFqcGdeQXVyMTUzOTcyODA5._V1_QL75_UX190_CR0,2,190,281_.jpg",Three sisters with a close bond who grew up in poverty. It is the exciting story of the sisters as they get embroiled in a major incident and face off against the wealthiest family in the nation.,Action Drama Mystery
action,The Matrix Resurrections,"https://m.media-amazon.com/images/M/MV5BMGJkNDJlZWUtOGM1Ny00YjNkLThiM2QtY2ZjMzQxMTIxNWNmXkEyXkFqcGdeQXVyMDM2NDM2MQ@@._V1_QL75_UX190_CR0,0,190,281_.jpg","Return to a world of two realities: one, everyday life; the other, what lies behind it. To find out if his reality is a construct, to truly know himself, Mr. Anderson will have to choose to follow the white rabbit once more.",Action Sci-Fi
action,Deadpool 2,"https://m.media-amazon.com/images/M/MV5BMDkzNmRhNTMtZDI4NC00Zjg1LTgxM2QtMjYxZDQ3OWJlMDRlXkEyXkFqcGdeQXVyNTU5MjkzMTU@._V1_QL75_UX190_CR0,2,190,281_.jpg","Foul-mouthed mutant mercenary Wade Wilson (a.k.a. Deadpool) assembles a team of fellow mutant rogues to protect a young boy with supernatural abilities from the brutal, time-traveling cyborg Cable.",Action Adventure Comedy
action,Star Trek: Deep Space Nine,"https://m.media-amazon.com/images/M/MV5BMDc3OGNhYjUtZGYwNi00MjllLWE0MjYtNDFiYmVhNWI0MGJmXkEyXkFqcGdeQXVyNTE1NjY5Mg@@._V1_QL75_UX190_CR0,1,190,281_.jpg","In the vicinity of the liberated planet of Bajor, the Federation space station Deep Space Nine guards the opening of a stable wormhole to the far side of the galaxy.",Action Adventure Drama
action,Call of Duty: Modern Warfare II,"https://m.media-amazon.com/images/M/MV5BMjZjODM2MDMtMGE2ZS00NWIyLTkzOWMtYjY0YTM3MzQ0ZjMzXkEyXkFqcGdeQXVyNTgyNTA4MjM@._V1_QL75_UX190_CR0,2,190,281_.jpg",A sequel to 2019's modern warfare,Action
action,Spider-Man,"https://m.media-amazon.com/images/M/MV5BZDEyN2NhMjgtMjdhNi00MmNlLWE5YTgtZGE4MzNjMTRlMGEwXkEyXkFqcGdeQXVyNDUyOTg3Njg@._V1_QL75_UY281_CR0,0,190,281_.jpg","After being bitten by a genetically-modified spider, a shy teenager gains spider-like abilities that he uses to fight injustice as a masked superhero and face a vengeful enemy.",Action Adventure Sci-Fi
action,Star Wars: Episode IV - A New Hope,"https://m.media-amazon.com/images/M/MV5BOTA5NjhiOTAtZWM0ZC00MWNhLThiMzEtZDFkOTk2OTU1ZDJkXkEyXkFqcGdeQXVyMTA4NDI1NTQx._V1_QL75_UX190_CR0,5,190,281_.jpg","Luke Skywalker joins forces with a Jedi Knight, a cocky pilot, a Wookiee and two droids to save the galaxy from the Empire's world-destroying battle station, while also attempting to rescue Princess Leia from the mysterious Darth Vader.",Action Adventure Fantasy
action,Gotham,"https://m.media-amazon.com/images/M/MV5BMmUyOTdjMGEtN2RmNC00YzUwLTg5ZDEtMTI1NWE4ZjcwN2ViXkEyXkFqcGdeQXVyNTA3MTU2MjE@._V1_QL75_UY281_CR2,0,190,281_.jpg",The story behind Detective James Gordon's rise to prominence in Gotham City in the years before Batman's arrival.,Action Crime Drama
action,Enola Holmes,"https://m.media-amazon.com/images/M/MV5BZjNkNzk0ZjEtM2M1ZC00MmMxLTlmOWEtNWRlZTc1ZTUyNzY4XkEyXkFqcGdeQXVyMTEyMjM2NDc2._V1_QL75_UX190_CR0,0,190,281_.jpg","When Enola Holmes-Sherlock's teen sister-discovers her mother is missing, she sets off to find her, becoming a super-sleuth in her own right as she outwits her famous brother and unravels a dangerous conspiracy around a mysterious young Lord.",Action Adventure Crime
action,Zack Snyder's Justice League,"https://m.media-amazon.com/images/M/MV5BYjI3NDg0ZTEtMDEwYS00YWMyLThjYjktMTNlM2NmYjc1OGRiXkEyXkFqcGdeQXVyMTEyMjM2NDc2._V1_QL75_UX190_CR0,0,190,281_.jpg","Determined to ensure that Superman's ultimate sacrifice wasn't in vain, Bruce Wayne recruits a team of metahumans to protect the world from an approaching threat of catastrophic proportions.",Action Adventure Fantasy
action,Captain America: New World Order,"https://m.media-amazon.com/images/M/MV5BNWMwNDU1M2YtMWQyOC00NGU3LWFlYjYtMmE0YTIyOTIzNjAwXkEyXkFqcGdeQXVyODk4OTc3MTY@._V1_QL75_UX190_CR0,0,190,281_.jpg",Plot kept under wraps. Fourth movie in the Captain America franchise.,Action Adventure Sci-Fi
action,Strange World,"https://m.media-amazon.com/images/M/MV5BMTE0Y2I1NDUtN2Q1YS00MTdhLTg0OTItZjJhNWJiNTUwYzM5XkEyXkFqcGdeQXVyNzc5MjA3OA@@._V1_QL75_UX190_CR0,0,190,281_.jpg",The legendary Clades are a family of explorers whose differences threaten to topple their latest and most crucial mission.,Animation Action Adventure
action,24,"https://m.media-amazon.com/images/M/MV5BMTg5OTkyNzA0NF5BMl5BanBnXkFtZTcwMDYyMDUwMg@@._V1_QL75_UY281_CR1,0,190,281_.jpg",Counter Terrorism Agent Jack Bauer races against the clock to subvert terrorist plots and save his nation from ultimate disaster.,Action Crime Drama
action,Suicide Squad,"https://m.media-amazon.com/images/M/MV5BMjM1OTMxNzUyM15BMl5BanBnXkFtZTgwNjYzMTIzOTE@._V1_QL75_UX190_CR0,0,190,281_.jpg",A secret government agency recruits some of the most dangerous incarcerated super-villains to form a defensive task force. Their first mission: save the world from the apocalypse.,Action Adventure Fantasy
action,Fast X,"https://m.media-amazon.com/images/M/MV5BYWY2Yzg4OTktYzIzMS00MGM4LWJiZmEtN2I0ZTg4NjYxYzY5XkEyXkFqcGdeQXVyMTM1MTE1NDMx._V1_QL75_UY281_CR18,0,190,281_.jpg",Plot unknown.,Action Crime Mystery
action,Avengers: Infinity War,"https://m.media-amazon.com/images/M/MV5BMjMxNjY2MDU1OV5BMl5BanBnXkFtZTgwNzY1MTUwNTM@._V1_QL75_UX190_CR0,0,190,281_.jpg",The Avengers and their allies must be willing to sacrifice all in an attempt to defeat the powerful Thanos before his blitz of devastation and ruin puts an end to the universe.,Action Adventure Sci-Fi
action,The New Mutants,"https://m.media-amazon.com/images/M/MV5BZDQ2NTdmNDgtMGIwMS00ODE2LTk5M2EtZGZhYzc4MWRlNTU3XkEyXkFqcGdeQXVyNTc4MjczMTM@._V1_QL75_UX190_CR0,0,190,281_.jpg","Five young mutants, just discovering their abilities while held in a secret facility against their will, fight to escape their past sins and save themselves.",Action Horror Mystery
action,Killing Eve,"https://m.media-amazon.com/images/M/MV5BZDJmODFjMzEtNTE4MS00OGViLTk4OGYtZjg3OGFhM2VlOTliXkEyXkFqcGdeQXVyMTkxNjUyNQ@@._V1_QL75_UX190_CR0,0,190,281_.jpg","After a series of events, the lives of a security operative and an assassin become inextricably linked.",Action Adventure Drama
action,John Wick: Chapter 4,"https://m.media-amazon.com/images/M/MV5BOTI1MDA5OTEtNWExMi00NGYwLThmMjUtMDhmNDQ4YTg1NzZlXkEyXkFqcGdeQXVyMTEyMjM2NDc2._V1_QL75_UY281_CR11,0,190,281_.jpg","John Wick (Keanu Reeves) takes on his most lethal adversaries yet in the upcoming fourth installment of the series. With the price on his head ever increasing, Wick takes his fight against the High Table global as he seeks out the most powerful players in the underworld, from New York to Paris to Osaka to Berlin. Lionsgate presents, a Thunder Road Films / 87eleven pro...",Action Crime Thriller
action,Avatar: The Last Airbender,"https://m.media-amazon.com/images/M/MV5BODc5YTBhMTItMjhkNi00ZTIxLWI0YjAtNTZmOTY0YjRlZGQ0XkEyXkFqcGdeQXVyODUwNjEzMzg@._V1_QL75_UY281_CR1,0,190,281_.jpg","In a war-torn world of elemental magic, a young boy reawakens to undertake a dangerous mystic quest to fulfill his destiny as the Avatar, and bring peace to the world.",Animation Action Adventure
action,The Mummy,"https://m.media-amazon.com/images/M/MV5BMTkwMTgwODAxMl5BMl5BanBnXkFtZTgwNTEwNTQ3MDI@._V1_QL75_UX190_CR0,10,190,281_.jpg","An ancient Egyptian princess is awakened from her crypt beneath the desert, bringing with her malevolence grown over millennia, and terrors that defy human comprehension.",Action Adventure Fantasy
action,WandaVision,"https://m.media-amazon.com/images/M/MV5BZGEwYmMwZmMtMTQ3MS00YWNhLWEwMmQtZTU5YTIwZmJjZGQ0XkEyXkFqcGdeQXVyMTI5MzA5MjA1._V1_QL75_UX190_CR0,2,190,281_.jpg","Blends the style of classic sitcoms with the MCU, in which Wanda Maximoff and Vision - two super-powered beings living their ideal suburban lives - begin to suspect that everything is not as it seems.",Action Comedy Drama
action,Oldboy,"https://m.media-amazon.com/images/M/MV5BMTI3NTQyMzU5M15BMl5BanBnXkFtZTcwMTM2MjgyMQ@@._V1_QL75_UX190_CR0,0,190,281_.jpg","After being kidnapped and imprisoned for fifteen years, Oh Dae-Su is released, only to find that he must find his captor in five days.",Action Drama Mystery
action,9-1-1: Lone Star,"https://m.media-amazon.com/images/M/MV5BZjNhNTI0ZTItNTJlMC00ZDI3LWEzNmYtYWFlODUwYjYxNGU3XkEyXkFqcGdeQXVyMjYwNDA2MDE@._V1_QL75_UY281_CR1,0,190,281_.jpg","A New York firefighter relocates to Austin, Texas with his son, where he works to save people's lives while trying to solve his own personal problems.",Action Drama Thriller
action,Professionals,"https://m.media-amazon.com/images/M/MV5BZTZjYjYzZmYtNDg0ZC00Nzg4LWJkNjktMjZjM2Q3NWY3NWQwXkEyXkFqcGdeQXVyMTkyNDExMDg@._V1_QL75_UY281_CR5,0,190,281_.jpg","After their advanced medical satellite explodes on deployment, billionaire futurist Peter Swann, and his fiancée, medical visionary Dr. Graciela ""Grace"" Davila, turn to a hardened former counterintelligence officer.",Action Adventure
action,Agents of S.H.I.E.L.D.,"https://m.media-amazon.com/images/M/MV5BMTkwODYyMjgzOV5BMl5BanBnXkFtZTgwODAzMTE5MjE@._V1_QL75_UX190_CR0,0,190,281_.jpg","The missions of the Strategic Homeland Intervention, Enforcement and Logistics Division.",Action Adventure Drama
action,Kick-Ass,"https://m.media-amazon.com/images/M/MV5BMTMzNzEzMDYxM15BMl5BanBnXkFtZTcwMTc0NTMxMw@@._V1_QL75_UX190_CR0,0,190,281_.jpg","Dave Lizewski is an unnoticed high school student and comic book fan who one day decides to become a superhero, even though he has no powers, training or meaningful reason to do so.",Action Comedy Crime
action,Van Helsing,"https://m.media-amazon.com/images/M/MV5BODRmY2NhNDItOWViNi00OTIyLTk3YjYtYzY0YTFlMDg1YzQ0L2ltYWdlL2ltYWdlXkEyXkFqcGdeQXVyMTQxNzMzNDI@._V1_QL75_UY281_CR2,0,190,281_.jpg","The famed monster hunter is sent to Transylvania to stop Count Dracula, who is using Dr. Frankenstein's research and a werewolf for nefarious purposes.",Action Adventure Fantasy
action,John Wick,"https://m.media-amazon.com/images/M/MV5BMTU2NjA1ODgzMF5BMl5BanBnXkFtZTgwMTM2MTI4MjE@._V1_QL75_UX190_CR0,2,190,281_.jpg",An ex-hit-man comes out of retirement to track down the gangsters that killed his dog and took his car.,Action Crime Thriller
action,Heat,"https://m.media-amazon.com/images/M/MV5BYjZjNTJlZGUtZTE1Ny00ZDc4LTgwYjUtMzk0NDgwYzZjYTk1XkEyXkFqcGdeQXVyNjU0OTQ0OTY@._V1_QL75_UY281_CR3,0,190,281_.jpg",A group of high-end professional thieves start to feel the heat from the LAPD when they unknowingly leave a clue at their latest heist.,Action Crime Drama
action,The King's Man,"https://m.media-amazon.com/images/M/MV5BMDEzZDY2ZDktNTlmOS00NThjLThkNTEtMjE5MzI5NWEwZmRjXkEyXkFqcGdeQXVyMDA4NzMyOA@@._V1_QL75_UX190_CR0,0,190,281_.jpg","In the early years of the 20th century, the Kingsman agency is formed to stand against a cabal plotting a war to wipe out millions.",Action Adventure Thriller
action,Thunderbolts,"https://m.media-amazon.com/images/M/MV5BMzdkNzFhMDAtNWVhNC00MDM5LTllYzktMWFkN2Q0ZWFlYWZkXkEyXkFqcGdeQXVyODk4OTc3MTY@._V1_QL75_UX190_CR0,0,190,281_.jpg",A group of supervillains are recruited to go on missions for the government.,Action Adventure Crime
action,Shazam!,"https://m.media-amazon.com/images/M/MV5BOWZhZjE4NGQtODg5Ni00MjQ1LWJmMzAtNzQ2N2M1NzYzMDJkXkEyXkFqcGdeQXVyMjMwNDgzNjc@._V1_QL75_UX190_CR0,0,190,281_.jpg",A newly fostered young boy in search of his mother instead finds unexpected super powers and soon gains a powerful enemy.,Action Adventure Comedy
action,Star Trek: Voyager,"https://m.media-amazon.com/images/M/MV5BYWIwMTI4NzctZmNjZi00OGU2LThhMGItZDI0ODAwOWI1NTFlXkEyXkFqcGdeQXVyNTE1NjY5Mg@@._V1_QL75_UY281_CR5,0,190,281_.jpg","Pulled to the far side of the galaxy, where the Federation is seventy-five years away at maximum warp speed, a Starfleet ship must cooperate with Maquis rebels to find a way home.",Action Adventure Sci-Fi
action,Deadpool 3,"https://m.media-amazon.com/images/M/MV5BMGI0ZDg3Y2EtYzIyYi00MGYwLThlOGItNWQ5MjMxNDU2ODUzXkEyXkFqcGdeQXVyMTEwMTcxOTAx._V1_QL75_UY281_CR20,0,190,281_.jpg",A weary wolverine finds himself recovering from his injuries when he comes across a loudmouth Deadpool who has time travelled forward to heal his greatest pal in the hopes to befriend the wild beast and to team up to take down a foe they both have in common,Action Comedy Sci-Fi
action,Mad Max: Fury Road,"https://m.media-amazon.com/images/M/MV5BN2EwM2I5OWMtMGQyMi00Zjg1LWJkNTctZTdjYTA4OGUwZjMyXkEyXkFqcGdeQXVyMTMxODk2OTU@._V1_QL75_UX190_CR0,0,190,281_.jpg","In a post-apocalyptic wasteland, a woman rebels against a tyrannical ruler in search for her homeland with the aid of a group of female prisoners, a psychotic worshiper, and a drifter named Max.",Action Adventure Sci-Fi
action,Star Wars: The Clone Wars,"https://m.media-amazon.com/images/M/MV5BZWFlNzRmOTItZjY1Ni00ZjZkLTk5MDgtOGFhOTYzNWFhYzhmXkEyXkFqcGdeQXVyMDM2NDM2MQ@@._V1_QL75_UX190_CR0,0,190,281_.jpg",Jedi Knights lead the Grand Army of the Republic against the droid army of the Separatists.,Animation Action Adventure
action,Rat Race,"https://m.media-amazon.com/images/M/MV5BNWEzM2NjMjctM2U3Yi00MGZhLWJlYTYtMWEyYjVjZDEzZjM4XkEyXkFqcGdeQXVyMTQxNzMzNDI@._V1_QL75_UX190_CR0,1,190,281_.jpg","A Las Vegas casino magnate, determined to find a new avenue for wagering, sets up a race for money.",Action Adventure Comedy
action,Batman and Superman: Battle of the Super Sons,"https://m.media-amazon.com/images/M/MV5BYmMwZGRlNDYtZDdmYy00MzBjLTg4NmItNTU5NzFiMDRkMDc4XkEyXkFqcGdeQXVyMTU0OTM5ODc1._V1_QL75_UY281_CR1,0,190,281_.jpg",Jonathan Kent and reluctant young sidekick Damian Wayne are burdened with saving the world from impending doom. The two must join forces to rescue their fathers and save the planet by becoming the super heroes they were intended to be.,Animation Action Sci-Fi
